{
  "schema_version": 1,
  "spec_slug": "cosmos-luna-may-2026",
  "built_at": "2026-05-15T15:00:00Z",
  "builder_version": "sample-manual-v0",
  "locale": "en",
  "output_target": {
    "format": "a4-magazine",
    "realizer": "weasyprint",
    "page_size": {"width": 210, "height": 297, "unit": "mm"},
    "bleed": {"value": 3, "unit": "mm"},
    "dpi": 300
  },
  "design_tokens": {
    "typography": {
      "display": {
        "family_chain": ["Playfair Display", "Source Serif 4", "Georgia", "Times New Roman"],
        "size_pt": 36,
        "weight": 700,
        "style": "normal",
        "line_height": 1.15,
        "color": "#1A1A1A"
      },
      "body": {
        "family_chain": ["Source Serif 4", "Georgia", "Times New Roman"],
        "size_pt": 11,
        "weight": 400,
        "style": "normal",
        "line_height": 1.5,
        "color": "#1A1A1A"
      },
      "meta": {
        "family_chain": ["IBM Plex Mono", "Menlo", "Courier"],
        "size_pt": 9,
        "weight": 400,
        "style": "normal",
        "line_height": 1.3,
        "letter_spacing": 0.08,
        "transform": "uppercase",
        "color": "#B5854A"
      },
      "caption": {
        "family_chain": ["Source Serif 4", "Georgia"],
        "size_pt": 9,
        "weight": 400,
        "style": "italic",
        "line_height": 1.3,
        "color": "#1A1A1A"
      },
      "kicker": {
        "family_chain": ["IBM Plex Mono", "Menlo", "Courier"],
        "size_pt": 10,
        "weight": 500,
        "letter_spacing": 0.12,
        "transform": "uppercase",
        "color": "#B5854A"
      },
      "pull_quote": {
        "family_chain": ["Playfair Display", "Source Serif 4", "Georgia"],
        "size_pt": 28,
        "weight": 400,
        "style": "italic",
        "line_height": 1.25,
        "color": "#1A1A1A"
      },
      "page_number": {
        "family_chain": ["IBM Plex Mono", "Menlo"],
        "size_pt": 8,
        "weight": 400,
        "color": "#1A1A1A"
      }
    },
    "color_palette": {
      "paper": "#F4EFE6",
      "ink": "#1A1A1A",
      "accent": "#B5854A",
      "muted": "#7A7670"
    },
    "margins": {
      "top": 15,
      "outer": 15,
      "inner": 18,
      "bottom": 18,
      "unit": "mm"
    }
  },
  "brand_authenticity": {
    "do_not_generate": ["logo", "mascot", "app_icon"],
    "do_not_approximate": ["MEOW LIFE wordmark", "Luna's specific face proportions"],
    "asset_provenance_required": ["cover_hero", "feature_hero"],
    "asset_provenance_optional": ["feature_captioned"]
  },
  "text_safe_default_rule": "When text overlays or sits inside a generated visual field, keep clean negative space inside each text-safe rectangle.",
  "claim_spine_ref": "library/articles/cosmos-luna-may-2026.yaml#claim_spine",
  "slides": [
    {
      "slide_idx": 1,
      "spread_idx": 1,
      "spread_type": "cover",
      "pages_per_instance": 1,
      "page_indices": [1],
      "regions": [
        {
          "id": "cover_hero",
          "rect_norm": [0.0, 0.0, 1.0, 1.0],
          "rect_px": [0, 0, 2480, 3508],
          "role": "image",
          "z_index": 0,
          "image": {
            "source_path": "images/spread-01/cover_hero.png",
            "crop_rect_norm": [0.0, 0.0, 1.0, 1.0],
            "fit_mode": "cover",
            "natural_aspect": "3:4",
            "alt_text": "Luna in EVA suit on lunar regolith",
            "asset_provenance": "vertex-gemini-3-pro-image upscale from codex storyboard 2026-05-15"
          }
        },
        {
          "id": "masthead",
          "rect_norm": [0.05, 0.04, 0.95, 0.12],
          "rect_px": [124, 140, 2356, 421],
          "role": "text",
          "z_index": 10,
          "text": "MEOW LIFE",
          "component": "Masthead",
          "typography": {
            "family_chain": ["Playfair Display", "Source Serif 4", "Georgia"],
            "size_pt": 48,
            "weight": 700,
            "line_height": 1.0,
            "color": "#F4EFE6"
          },
          "text_safe_required": true,
          "text_safe_rule": "Top 12% of cover_hero image must have low foreground detail so MEOW LIFE wordmark reads cleanly in paper color on the hero image.",
          "bind_field": "brand.masthead"
        },
        {
          "id": "cover_kicker",
          "rect_norm": [0.06, 0.78, 0.94, 0.83],
          "rect_px": [149, 2736, 2331, 2912],
          "role": "text",
          "z_index": 10,
          "text": "FEATURE STORY",
          "component": "CoverLine",
          "component_props": {"align": "left"},
          "typography": {
            "family_chain": ["IBM Plex Mono", "Menlo"],
            "size_pt": 10,
            "weight": 500,
            "letter_spacing": 0.12,
            "transform": "uppercase",
            "color": "#F4EFE6"
          },
          "text_safe_required": true,
          "bind_field": "cover_kicker.en",
          "claim_role": "kicker"
        },
        {
          "id": "cover_line",
          "rect_norm": [0.06, 0.84, 0.94, 0.95],
          "rect_px": [149, 2947, 2331, 3333],
          "role": "text",
          "z_index": 10,
          "text": "A small astronaut on the lunar regolith, photographed for eleven days.",
          "component": "CoverLine",
          "component_props": {"align": "left"},
          "typography": {
            "family_chain": ["Playfair Display", "Source Serif 4", "Georgia"],
            "size_pt": 22,
            "weight": 400,
            "style": "italic",
            "line_height": 1.2,
            "color": "#F4EFE6"
          },
          "text_safe_required": true,
          "bind_field": "claim_spine.spread_claims[0].claim_title",
          "claim_role": "claim_title"
        }
      ]
    },
    {
      "slide_idx": 3,
      "spread_idx": 3,
      "spread_type": "feature-spread",
      "pages_per_instance": 2,
      "page_indices": [4, 5],
      "regions": [
        {
          "id": "hero_image",
          "rect_norm": [0.0, 0.0, 0.5, 1.0],
          "rect_px": [0, 0, 2480, 3508],
          "role": "image",
          "z_index": 0,
          "image": {
            "source_path": "images/spread-03/feature_hero.png",
            "crop_rect_norm": [0.0, 0.0, 1.0, 1.0],
            "fit_mode": "cover",
            "natural_aspect": "3:4",
            "alt_text": "Luna at module airlock, hand on hatch, Earth visible upper right",
            "asset_provenance": "vertex-gemini-3-pro-image upscale 2026-05-15"
          }
        },
        {
          "id": "kicker",
          "rect_norm": [0.55, 0.08, 0.95, 0.12],
          "rect_px": [2728, 281, 4712, 421],
          "role": "text",
          "z_index": 10,
          "text": "Chapter 01",
          "component": "Kicker",
          "typography": {
            "family_chain": ["IBM Plex Mono", "Menlo"],
            "size_pt": 10,
            "weight": 500,
            "letter_spacing": 0.12,
            "transform": "uppercase",
            "color": "#B5854A"
          },
          "bind_field": "spread_copy[2].kicker.en",
          "claim_role": "kicker"
        },
        {
          "id": "accent_rule_top",
          "rect_norm": [0.55, 0.13, 0.70, 0.135],
          "rect_px": [2728, 456, 3472, 474],
          "role": "accent",
          "z_index": 10,
          "accent": {
            "color": "#B5854A",
            "thickness_pt": 0.75,
            "style": "hairline"
          }
        },
        {
          "id": "title",
          "rect_norm": [0.55, 0.15, 0.95, 0.30],
          "rect_px": [2728, 526, 4712, 1052],
          "role": "text",
          "z_index": 10,
          "text": "DEPARTURE",
          "component": "Title",
          "component_props": {"align": "left"},
          "typography": {
            "family_chain": ["Playfair Display", "Source Serif 4", "Georgia"],
            "size_pt": 48,
            "weight": 700,
            "line_height": 1.05,
            "letter_spacing": 0.04,
            "color": "#1A1A1A"
          },
          "text_safe_required": true,
          "bind_field": "spread_copy[2].title.en"
        },
        {
          "id": "lead",
          "rect_norm": [0.55, 0.33, 0.95, 0.43],
          "rect_px": [2728, 1158, 4712, 1508],
          "role": "text",
          "z_index": 10,
          "text": "She steps from the module into a silence that has waited four billion years for the sound of a paw.",
          "component": "Lead",
          "typography": {
            "family_chain": ["Source Serif 4", "Georgia"],
            "size_pt": 13,
            "weight": 400,
            "style": "italic",
            "line_height": 1.4,
            "color": "#1A1A1A"
          },
          "bind_field": "spread_copy[2].lead.en",
          "claim_role": "claim_title"
        },
        {
          "id": "body",
          "rect_norm": [0.55, 0.46, 0.95, 0.83],
          "rect_px": [2728, 1614, 4712, 2912],
          "role": "text",
          "z_index": 10,
          "text": "First steps onto the lunar surface are quieter than anyone tells you. The suit's life support hums; the regolith makes no sound. Luna's footprints will outlast every photograph in this issue.\n\nShe moves with the slow deliberation of low gravity — each step a small flight, ending in a deeper-than-expected sink as the dust gives way. Earth is a small blue marble in the upper right of frame, and she will be photographed against it for the next eleven days.\n\nThe light here is unforgiving. There is no atmospheric scatter to soften the shadows; there is no fill. What you see is what the sun gives you, and the sun on the Moon is a single hard key from above the horizon.",
          "component": "BodyWithDropCap",
          "component_props": {
            "drop_cap": true,
            "drop_cap_lines": 3,
            "hyphenate": true,
            "align": "justify"
          },
          "typography": {
            "family_chain": ["Source Serif 4", "Georgia"],
            "size_pt": 11,
            "weight": 400,